{"$schema":"http://json-schema.org/draft-07/schema#","$id":"https://agentic-website-studio.local/schemas/m43-qa-report.schema.json","type":"object","required":["schemaVersion","reportId","sourceManifestSha256","independentAuditSha256","overallResult","testCounts","categories","warnings","humanOnlyLimitations"],"properties":{"schemaVersion":{"const":"1.0.0"},"reportId":{"const":"qa_wayfinder_m43_full_01"},"projectId":{"type":"string"},"sourceManifestSha256":{"type":"string","pattern":"^[a-f0-9]{64}$"},"independentAuditSha256":{"type":"string","pattern":"^[a-f0-9]{64}$"},"overallResult":{"enum":["pass","pass_with_warnings"]},"testCounts":{"type":"object"},"categories":{"type":"object"},"warnings":{"type":"array"},"humanOnlyLimitations":{"type":"array"}}}
